[
  {
    "record_id": "YOR-000001",
    "source_lang": "yor",
    "source_text": "Báwo ní",
    "source_text_normalized": "Báwo ní",
    "english_translation": "Hi",
    "verified": true,
    "source": "NKENNE lessons",
    "source_url": "",
    "created_at": "2026-08-29"
  },
  {
    "record_id": "YOR-000002",
    "source_lang": "yor",
    "source_text": "Báwo ni o ṣe wà?",
    "source_text_normalized": "Báwo ni o ṣe wà?",
    "english_translation": "How are you?",
    "verified": true,
    "source": "NKENNE lessons",
    "source_url": "",
    "created_at": "2026-08-29"
  },
  {
    "record_id": "YOR-000003",
    "source_lang": "yor",
    "source_text": "Mo wà dáadáa",
    "source_text_normalized": "Mo wà dáadáa",
    "english_translation": "“I am fine”",
    "verified": true,
    "source": "NKENNE lessons",
    "source_url": "",
    "created_at": "2026-08-29"
  },
  {
    "record_id": "YOR-000004",
    "source_lang": "yor",
    "source_text": "Báwo ni ẹ ṣe wà?",
    "source_text_normalized": "Báwo ni ẹ ṣe wà?",
    "english_translation": "How are you?(plural",
    "verified": true,
    "source": "NKENNE lessons",
    "source_url": "",
    "created_at": "2026-08-29"
  },
  {
    "record_id": "YOR-000005",
    "source_lang": "yor",
    "source_text": "A wà dáadáa",
    "source_text_normalized": "A wà dáadáa",
    "english_translation": "We are fine",
    "verified": true,
    "source": "NKENNE lessons",
    "source_url": "",
    "created_at": "2026-08-29"
  },
  {
    "record_id": "YOR-000006",
    "source_lang": "yor",
    "source_text": "Kú àárọ̀",
    "source_text_normalized": "Kú àárọ̀",
    "english_translation": "Good afternoon",
    "verified": true,
    "source": "NKENNE lessons",
    "source_url": "",
    "created_at": "2026-08-29"
  },
  {
    "record_id": "YOR-000007",
    "source_lang": "yor",
    "source_text": "Kú ọ̀sán",
    "source_text_normalized": "Kú ọ̀sán",
    "english_translation": "Good afternoon”",
    "verified": true,
    "source": "NKENNE lessons",
    "source_url": "",
    "created_at": "2026-08-29"
  },
  {
    "record_id": "YOR-000008",
    "source_lang": "yor",
    "source_text": "Kú ìrọ̀lẹ́",
    "source_text_normalized": "Kú ìrọ̀lẹ́",
    "english_translation": "Good evening",
    "verified": true,
    "source": "NKENNE lessons",
    "source_url": "",
    "created_at": "2026-08-29"
  },
  {
    "record_id": "YOR-000009",
    "source_lang": "yor",
    "source_text": "Ó dàárọ̀.",
    "source_text_normalized": "Ó dàárọ̀.",
    "english_translation": "Goodnight",
    "verified": true,
    "source": "NKENNE lessons",
    "source_url": "",
    "created_at": "2026-08-29"
  },
  {
    "record_id": "YOR-000010",
    "source_lang": "yor",
    "source_text": "Kín ni orúkọ rẹ?",
    "source_text_normalized": "Kín ni orúkọ rẹ?",
    "english_translation": "What is your name?",
    "verified": true,
    "source": "NKENNE lessons",
    "source_url": "",
    "created_at": "2026-08-29"
  },
  {
    "record_id": "SWA-000001",
    "source_lang": "swa",
    "source_text": "Jina langu",
    "source_text_normalized": "Jina langu",
    "english_translation": "My name",
    "verified": true,
    "source": "NKENNE lessons",
    "source_url": "",
    "created_at": "2026-08-29"
  },
  {
    "record_id": "SWA-000002",
    "source_lang": "swa",
    "source_text": "Jina langu ni Bwana Okoro",
    "source_text_normalized": "Jina langu ni Bwana Okoro",
    "english_translation": "My name is Mr Okoro",
    "verified": true,
    "source": "NKENNE lessons",
    "source_url": "",
    "created_at": "2026-08-29"
  },
  {
    "record_id": "SWA-000003",
    "source_lang": "swa",
    "source_text": "Jina lako nani?",
    "source_text_normalized": "Jina lako nani?",
    "english_translation": "What is your name?",
    "verified": true,
    "source": "NKENNE lessons",
    "source_url": "",
    "created_at": "2026-08-29"
  },
  {
    "record_id": "SWA-000004",
    "source_lang": "swa",
    "source_text": "Je, jina lako ni Bwana Okoro?",
    "source_text_normalized": "Je, jina lako ni Bwana Okoro?",
    "english_translation": "Is your name Mr Okoro?",
    "verified": true,
    "source": "NKENNE lessons",
    "source_url": "",
    "created_at": "2026-08-29"
  },
  {
    "record_id": "SWA-000005",
    "source_lang": "swa",
    "source_text": "Ndiyo, Bibi",
    "source_text_normalized": "Ndiyo, Bibi",
    "english_translation": "Yes, Miss",
    "verified": true,
    "source": "NKENNE lessons",
    "source_url": "",
    "created_at": "2026-08-29"
  },
  {
    "record_id": "SWA-000006",
    "source_lang": "swa",
    "source_text": "Karibu",
    "source_text_normalized": "Karibu",
    "english_translation": "You are welcome",
    "verified": true,
    "source": "NKENNE lessons",
    "source_url": "",
    "created_at": "2026-08-29"
  },
  {
    "record_id": "SWA-000007",
    "source_lang": "swa",
    "source_text": "Bwana Okoro karibu",
    "source_text_normalized": "Bwana Okoro karibu",
    "english_translation": "Mr Okoro welcome",
    "verified": true,
    "source": "NKENNE lessons",
    "source_url": "",
    "created_at": "2026-08-29"
  },
  {
    "record_id": "SWA-000008",
    "source_lang": "swa",
    "source_text": "Karibu kwenye ofisi ya ESM",
    "source_text_normalized": "Karibu kwenye ofisi ya ESM",
    "english_translation": "You are welcome to ESM office",
    "verified": true,
    "source": "NKENNE lessons",
    "source_url": "",
    "created_at": "2026-08-29"
  },
  {
    "record_id": "SWA-000009",
    "source_lang": "swa",
    "source_text": "Asante, Bibi",
    "source_text_normalized": "Asante, Bibi",
    "english_translation": "Thanks, Miss",
    "verified": true,
    "source": "NKENNE lessons",
    "source_url": "",
    "created_at": "2026-08-29"
  },
  {
    "record_id": "SWA-000010",
    "source_lang": "swa",
    "source_text": "Asante",
    "source_text_normalized": "Asante",
    "english_translation": "Thank you",
    "verified": true,
    "source": "NKENNE lessons",
    "source_url": "",
    "created_at": "2026-08-29"
  },
  {
    "record_id": "PCM-000001",
    "source_lang": "pcm",
    "source_text": "Pdgin",
    "source_text_normalized": "Pdgin",
    "english_translation": "English",
    "verified": true,
    "source": "NKENNE lessons",
    "source_url": "",
    "created_at": "2026-08-29"
  },
  {
    "record_id": "PCM-000002",
    "source_lang": "pcm",
    "source_text": "How you de",
    "source_text_normalized": "How you de",
    "english_translation": "Hi",
    "verified": true,
    "source": "NKENNE lessons",
    "source_url": "",
    "created_at": "2026-08-29"
  },
  {
    "record_id": "PCM-000003",
    "source_lang": "pcm",
    "source_text": "Dis one na letter wey my friend send me.",
    "source_text_normalized": "Dis one na letter wey my friend send me.",
    "english_translation": "Here’s a letter from my friend",
    "verified": true,
    "source": "NKENNE lessons",
    "source_url": "",
    "created_at": "2026-08-29"
  },
  {
    "record_id": "PCM-000004",
    "source_lang": "pcm",
    "source_text": "Dem dey come today for sure",
    "source_text_normalized": "Dem dey come today for sure",
    "english_translation": "Certainly, They are arriving today",
    "verified": true,
    "source": "NKENNE lessons",
    "source_url": "",
    "created_at": "2026-08-29"
  },
  {
    "record_id": "PCM-000005",
    "source_lang": "pcm",
    "source_text": "Her daughter pikin dey come with her too?",
    "source_text_normalized": "Her daughter pikin dey come with her too?",
    "english_translation": "Is her daughter coming with her?",
    "verified": true,
    "source": "NKENNE lessons",
    "source_url": "",
    "created_at": "2026-08-29"
  },
  {
    "record_id": "PCM-000006",
    "source_lang": "pcm",
    "source_text": "But na her husband like to stay home pass",
    "source_text_normalized": "But na her husband like to stay home pass",
    "english_translation": "But her husband prefers to stay at home",
    "verified": true,
    "source": "NKENNE lessons",
    "source_url": "",
    "created_at": "2026-08-29"
  },
  {
    "record_id": "PCM-000007",
    "source_lang": "pcm",
    "source_text": "E no like to travel",
    "source_text_normalized": "E no like to travel",
    "english_translation": "He doesn’t like to travel",
    "verified": true,
    "source": "NKENNE lessons",
    "source_url": "",
    "created_at": "2026-08-29"
  },
  {
    "record_id": "PCM-000008",
    "source_lang": "pcm",
    "source_text": "She like to travel wit her daughter pikin",
    "source_text_normalized": "She like to travel wit her daughter pikin",
    "english_translation": "No, that’s not important",
    "verified": true,
    "source": "NKENNE lessons",
    "source_url": "",
    "created_at": "2026-08-29"
  },
  {
    "record_id": "PCM-000009",
    "source_lang": "pcm",
    "source_text": "Dem arrive around 9:20 by car",
    "source_text_normalized": "Dem arrive around 9:20 by car",
    "english_translation": "They arrived at 9:20 by car",
    "verified": true,
    "source": "NKENNE lessons",
    "source_url": "",
    "created_at": "2026-08-29"
  },
  {
    "record_id": "PCM-000010",
    "source_lang": "pcm",
    "source_text": "Dem go stay for 2 days",
    "source_text_normalized": "Dem go stay for 2 days",
    "english_translation": "They are staying for 2 days",
    "verified": true,
    "source": "NKENNE lessons",
    "source_url": "",
    "created_at": "2026-08-29"
  }
]